UC1-Create address book service database

mysql> create database addressBook_Service_new;
Query OK, 1 row affected (0.67 sec)

mysql> show databases;
+-------------------------+
| Database                |
+-------------------------+
| addressbook_service     |
| addressbook_service_new |
| employee_payroll        |
| information_schema      |
| mysql                   |
| payroll_service         |
| payroll_service_new     |
| performance_schema      |
| sys                     |
+-------------------------+
9 rows in set (0.00 sec)

mysql> use addressBook_Service_new;
Database changed

UC2-Create address book table

mysql> create table addressbook
    -> (
    -> firstName varchar(30) not null,
    -> lastName varchar(30) not null,
    -> address varchar(80) not null,
    -> city varchar(25) not null,
    -> state varchar(25) not null,
    -> zipCode int not null,
    -> phoneNumber varchar(250) not null,
    -> email varchar(20) not null);
Query OK, 0 rows affected (0.23 sec)

mysql> desc addressbook;
+-------------+--------------+------+-----+---------+-------+
| Field       | Type         | Null | Key | Default | Extra |
+-------------+--------------+------+-----+---------+-------+
| firstName   | varchar(30)  | NO   |     | NULL    |       |
| lastName    | varchar(30)  | NO   |     | NULL    |       |
| address     | varchar(80)  | NO   |     | NULL    |       |
| city        | varchar(25)  | NO   |     | NULL    |       |
| state       | varchar(25)  | NO   |     | NULL    |       |
| zipCode     | int          | NO   |     | NULL    |       |
| phoneNumber | varchar(250) | NO   |     | NULL    |       |
| email       | varchar(20)  | NO   |     | NULL    |       |
+-------------+--------------+------+-----+---------+-------+
8 rows in set (0.00 sec)

UC3-Insert new contacts to address book

mysql> insert into addressbook(firstName,lastName,address,city,state,zipCode,phoneNumber,email)values('surabhi', 'bhagat', 'kothrud', 'pune', 'maharashtra', 411026, 8957463215, 'sur12@gmail.com');
Query OK, 1 row affected (0.28 sec)

mysql> insert into addressbook(firstName,lastName,address,city,state,zipCode,phoneNumber,email)values('manoj','mahajan','warje','pune','maharashtra',411035,8541236598,'manu32@gmail.com');
Query OK, 1 row affected (0.08 sec)

mysql> insert into addressbook(firstName,lastName,address,city,state,zipCode,phoneNumber,email)values('sheetal','adagale','shivajinagar','pune','maharashtra',411025,7845213659,'sheetal@gmail.com');
Query OK, 1 row affected (0.31 sec)

mysql> select * from addressbook;
+-----------+----------+--------------+------+-------------+---------+-------------+-------------------+
| firstName | lastName | address      | city | state       | zipCode | phoneNumber | email             |
+-----------+----------+--------------+------+-------------+---------+-------------+-------------------+
| surabhi   | bhagat   | kothrud      | pune | maharashtra |  411026 | 8957463215  | sur12@gmail.com   |
| manoj     | mahajan  | warje        | pune | maharashtra |  411035 | 8541236598  | manu32@gmail.com  |
| sheetal   | adagale  | shivajinagar | pune | maharashtra |  411025 | 7845213659  | sheetal@gmail.com |
+-----------+----------+--------------+------+-------------+---------+-------------+-------------------+
3 rows in set (0.03 sec)

UC4-Edit existing contact person using their name

mysql> update addressbook set address = 'pimpri' where firstName = 'sheetal';
Query OK, 1 row affected (0.07 sec)
Rows matched: 1  Changed: 1  Warnings: 0

mysql> select * from addressbook;
+-----------+----------+---------+------+-------------+---------+-------------+-------------------+
| firstName | lastName | address | city | state       | zipCode | phoneNumber | email             |
+-----------+----------+---------+------+-------------+---------+-------------+-------------------+
| surabhi   | bhagat   | kothrud | pune | maharashtra |  411026 | 8957463215  | sur12@gmail.com   |
| manoj     | mahajan  | warje   | pune | maharashtra |  411035 | 8541236598  | manu32@gmail.com  |
| sheetal   | adagale  | pimpri  | pune | maharashtra |  411025 | 7845213659  | sheetal@gmail.com |
+-----------+----------+---------+------+-------------+---------+-------------+-------------------+
3 rows in set (0.00 sec)

UC5-Delete person using person's name

mysql> delete from addressbook where firstName = 'manoj';
Query OK, 1 row affected (0.17 sec)

mysql> select * from addressbook;
+-----------+----------+---------+------+-------------+---------+-------------+-------------------+
| firstName | lastName | address | city | state       | zipCode | phoneNumber | email             |
+-----------+----------+---------+------+-------------+---------+-------------+-------------------+
| surabhi   | bhagat   | kothrud | pune | maharashtra |  411026 | 8957463215  | sur12@gmail.com   |
| sheetal   | adagale  | pimpri  | pune | maharashtra |  411025 | 7845213659  | sheetal@gmail.com |
+-----------+----------+---------+------+-------------+---------+-------------+-------------------+
2 rows in set (0.00 sec)

UC6-Retrieve person belonging to a city or state from the address book

mysql> select * from addressbook where city = 'pune' or state = 'maharashtra';
+-----------+----------+---------+------+-------------+---------+-------------+-------------------+
| firstName | lastName | address | city | state       | zipCode | phoneNumber | email             |
+-----------+----------+---------+------+-------------+---------+-------------+-------------------+
| surabhi   | bhagat   | kothrud | pune | maharashtra |  411026 | 8957463215  | sur12@gmail.com   |
| sheetal   | adagale  | pimpri  | pune | maharashtra |  411025 | 7845213659  | sheetal@gmail.com |
+-----------+----------+---------+------+-------------+---------+-------------+-------------------+
2 rows in set (0.00 sec)

UC7-Size of address book by city and state

mysql> insert into addressbook(firstName,lastName,address,city,state,zipCode,phoneNumber,email)values('sakshi', 'bhagat', 'kumbrepark', 'pune', 'maharashtra', 411025, 9857412368, 'sakshi@gmail.com'),('chetan','shinde','nagar','bhopal','madhyapradesh',123456,7845938923,'chetu32@gmail.com');
Query OK, 2 rows affected (1.33 sec)
Records: 2  Duplicates: 0  Warnings: 0

mysql> select * from addressbook;
+-----------+----------+------------+--------+---------------+---------+-------------+-------------------+
| firstName | lastName | address    | city   | state         | zipCode | phoneNumber | email             |
+-----------+----------+------------+--------+---------------+---------+-------------+-------------------+
| surabhi   | bhagat   | kothrud    | pune   | maharashtra   |  411026 | 8957463215  | sur12@gmail.com   |
| sheetal   | adagale  | pimpri     | pune   | maharashtra   |  411025 | 7845213659  | sheetal@gmail.com |
| sakshi    | bhagat   | kumbrepark | pune   | maharashtra   |  411025 | 9857412368  | sakshi@gmail.com  |
| chetan    | shinde   | nagar      | bhopal | madhyapradesh |  123456 | 7845938923  | chetu32@gmail.com |
+-----------+----------+------------+--------+---------------+---------+-------------+-------------------+
4 rows in set (0.04 sec)

mysql> update addressbook set city = 'nanded' where firstName = 'sheetal';
Query OK, 1 row affected (0.17 sec)
Rows matched: 1  Changed: 1  Warnings: 0

mysql> select * from addressbook;
+-----------+----------+------------+--------+---------------+---------+-------------+-------------------+
| firstName | lastName | address    | city   | state         | zipCode | phoneNumber | email             |
+-----------+----------+------------+--------+---------------+---------+-------------+-------------------+
| surabhi   | bhagat   | kothrud    | pune   | maharashtra   |  411026 | 8957463215  | sur12@gmail.com   |
| sheetal   | adagale  | pimpri     | nanded | maharashtra   |  411025 | 7845213659  | sheetal@gmail.com |
| sakshi    | bhagat   | kumbrepark | pune   | maharashtra   |  411025 | 9857412368  | sakshi@gmail.com  |
| chetan    | shinde   | nagar      | bhopal | madhyapradesh |  123456 | 7845938923  | chetu32@gmail.com |
+-----------+----------+------------+--------+---------------+---------+-------------+-------------------+
4 rows in set (0.00 sec)

mysql> select count(city) from addressbook where city = 'pune';
+-------------+
| count(city) |
+-------------+
|           2 |
+-------------+
1 row in set (0.00 sec)

mysql> select count(state) from addressbook where state = 'maharashtra';
+--------------+
| count(state) |
+--------------+
|            3 |
+--------------+
1 row in set (0.00 sec)

UC8-Retrieve entries sorted alphabetically by person's name for a given city

mysql> select * from addressbook where city = 'pune' order by firstName;
+-----------+----------+------------+------+-------------+---------+-------------+------------------+
| firstName | lastName | address    | city | state       | zipCode | phoneNumber | email            |
+-----------+----------+------------+------+-------------+---------+-------------+------------------+
| sakshi    | bhagat   | kumbrepark | pune | maharashtra |  411025 | 9857412368  | sakshi@gmail.com |
| surabhi   | bhagat   | kothrud    | pune | maharashtra |  411026 | 8957463215  | sur12@gmail.com  |
+-----------+----------+------------+------+-------------+---------+-------------+------------------+
2 rows in set (0.17 sec)

UC9-Identify each address book with name and type

mysql> alter table addressbook add column addressbook_name varchar(20), add column addressbook_type varchar(25);
Query OK, 0 rows affected (3.06 sec)
Records: 0  Duplicates: 0  Warnings: 0

mysql> select * from addressbook;
+-----------+----------+------------+--------+---------------+---------+-------------+-------------------+------------------+------------------+
| firstName | lastName | address    | city   | state         | zipCode | phoneNumber | email             | addressbook_name | addressbook_type |
+-----------+----------+------------+--------+---------------+---------+-------------+-------------------+------------------+------------------+
| surabhi   | bhagat   | kothrud    | pune   | maharashtra   |  411026 | 8957463215  | sur12@gmail.com   | NULL             | NULL             |
| sheetal   | adagale  | pimpri     | nanded | maharashtra   |  411025 | 7845213659  | sheetal@gmail.com | NULL             | NULL             |
| sakshi    | bhagat   | kumbrepark | pune   | maharashtra   |  411025 | 9857412368  | sakshi@gmail.com  | NULL             | NULL             |
| chetan    | shinde   | nagar      | bhopal | madhyapradesh |  123456 | 7845938923  | chetu32@gmail.com | NULL             | NULL             |
+-----------+----------+------------+--------+---------------+---------+-------------+-------------------+------------------+------------------+
4 rows in set (0.00 sec)

mysql> update addressbook set addressbook_name = 'book1', addressbook_type = 'family' where firstName = 'surabhi';
Query OK, 1 row affected (0.06 sec)
Rows matched: 1  Changed: 1  Warnings: 0

mysql> update addressbook set addressbook_name = 'book2', addressbook_type = 'friends' where firstName = 'sheetal';
Query OK, 1 row affected (0.14 sec)
Rows matched: 1  Changed: 1  Warnings: 0

mysql> update addressbook set addressbook_name = 'book1', addressbook_type = 'family' where firstName = 'sakshi';
Query OK, 1 row affected (0.08 sec)
Rows matched: 1  Changed: 1  Warnings: 0

mysql> update addressbook set addressbook_name = 'book3', addressbook_type = 'profession' where firstName = 'chetan';
Query OK, 1 row affected (0.07 sec)
Rows matched: 1  Changed: 1  Warnings: 0

mysql> select * from addressbook;
+-----------+----------+------------+--------+---------------+---------+-------------+-------------------+------------------+------------------+
| firstName | lastName | address    | city   | state         | zipCode | phoneNumber | email             | addressbook_name | addressbook_type |
+-----------+----------+------------+--------+---------------+---------+-------------+-------------------+------------------+------------------+
| surabhi   | bhagat   | kothrud    | pune   | maharashtra   |  411026 | 8957463215  | sur12@gmail.com   | book1            | family           |
| sheetal   | adagale  | pimpri     | nanded | maharashtra   |  411025 | 7845213659  | sheetal@gmail.com | book2            | friends          |
| sakshi    | bhagat   | kumbrepark | pune   | maharashtra   |  411025 | 9857412368  | sakshi@gmail.com  | book1            | family           |
| chetan    | shinde   | nagar      | bhopal | madhyapradesh |  123456 | 7845938923  | chetu32@gmail.com | book3            | profession       |
+-----------+----------+------------+--------+---------------+---------+-------------+-------------------+------------------+------------------+
4 rows in set (0.00 sec)




